{"verdict": "hold", "verdict_reason": "held on a law-surface defect; project stage label preserved", "reviewer_role": "advisor", "reviewer_model": "model-x", "reviewer_effort": "max", "evidence_claimed": "L2", "evidence_verified": "L2", "findings": [{"id": "F-1", "severity": "blocker", "summary": "unrecorded ruling stamp"}], "gate_results": [], "merge_recommendation": "hold", "stage_raw": "adversarial-sweep", "unit_kind_raw": "framework-deliverable"}
